{
  "version": "1.2.0",
  "generation_policy": {
    "invented_values_allowed": false,
    "semantic_guessing_allowed": false,
    "canonicalization": [
      "Canonical keys use lowercase snake_case.",
      "Only exact canonical values or explicitly listed aliases are accepted for categorical fields.",
      "Case-insensitive comparison and surrounding-whitespace trimming do not create new aliases."
    ],
    "alias_merge_policy": "Aliases are included only when directly implemented by SYNONYM_MAP or when approved source text is explicitly preserved as a surface form. Similar-looking concepts are not merged by inference.",
    "sources": [
      "research_artifacts/runtime_v1/evidence_aware_rules_v1.json",
      "research_artifacts/runtime_v1/compiled_diagnostic_rules_v1.json",
      "research_artifacts/runtime_v1/neuro_symbolic_input_schema_v1.json",
      "neuro_symbolic/reasoning_engine.py:SYNONYM_MAP",
      "knowledge_graph/phenotype_graph.json"
    ]
  },
  "fields": {
    "lesion_present": {
      "type": "boolean",
      "input_types": [
        "boolean"
      ],
      "categorical_values_available": false,
      "allowed_values": null,
      "enum_validated": true,
      "boolean_support": true,
      "boolean_allowed_values": [
        true,
        false
      ],
      "boolean_values_origin": "Phase 6 input schema type; true and false are schema-defined values, not evidence-derived disease categories.",
      "numeric_constraints": null,
      "field_source": "research_artifacts/runtime_v1/neuro_symbolic_input_schema_v1.json:visual_features.lesion_present",
      "limitations": [
        "No evidence-backed categorical string vocabulary is available for this field."
      ]
    },
    "lesion_shape": {
      "type": "string",
      "input_types": [
        "string"
      ],
      "categorical_values_available": true,
      "allowed_values": [
        {
          "canonical_value": "spindle_shaped",
          "display_name": "Spindle-shaped",
          "original_values": [
            "Spindle-shaped"
          ],
          "aliases": [
            {
              "value": "spindle shaped",
              "source": "explicit_normalization_alias",
              "source_reference": "neuro_symbolic/reasoning_engine.py:SYNONYM_MAP:spindle shaped -> spindle"
            },
            {
              "value": "spindle-shaped",
              "source": "explicit_normalization_alias",
              "source_reference": "neuro_symbolic/reasoning_engine.py:SYNONYM_MAP:spindle-shaped -> spindle"
            }
          ],
          "provenance": {
            "source_rule_ids": [],
            "evidence_ids": [],
            "record_ids": [],
            "source_ids": [
              "draft_phenotype_leaf_blast_001"
            ],
            "citations": [],
            "source_texts": [
              "Spindle-shaped or diamond-shaped lesions"
            ],
            "source_artifacts": [
              "knowledge_graph/phenotype_graph.json"
            ]
          }
        },
        {
          "canonical_value": "diamond_shaped",
          "display_name": "Diamond-shaped",
          "original_values": [
            "diamond-shaped"
          ],
          "aliases": [
            {
              "value": "diamond-shaped",
              "source": "canonical_phenotype_surface_form",
              "source_reference": "knowledge_graph/phenotype_graph.json:draft_phenotype_leaf_blast_001"
            }
          ],
          "provenance": {
            "source_rule_ids": [],
            "evidence_ids": [],
            "record_ids": [],
            "source_ids": [
              "draft_phenotype_leaf_blast_001"
            ],
            "citations": [],
            "source_texts": [
              "Spindle-shaped or diamond-shaped lesions"
            ],
            "source_artifacts": [
              "knowledge_graph/phenotype_graph.json"
            ]
          }
        },
        {
          "canonical_value": "oval",
          "display_name": "Oval",
          "original_values": [
            "oval"
          ],
          "aliases": [
            {
              "value": "oval",
              "source": "explicit_normalization_alias",
              "source_reference": "neuro_symbolic/reasoning_engine.py:SYNONYM_MAP:oval -> oval"
            }
          ],
          "provenance": {
            "source_rule_ids": [
              "EA_RULE_EE3FB34441"
            ],
            "evidence_ids": [],
            "record_ids": [
              "MKI_0914",
              "BSP_IMPL_293",
              "BSP_RULE_002"
            ],
            "source_ids": [
              "IRRI2018_FFD"
            ],
            "citations": [
              "Mew, T. W., Hibino, H., Savary, S., Vera Cruz, C. M., Opulencia, R., and Hettel, G. P., eds. 2018. Rice Diseases: Biology and Selected Management Practices. Los Baños, Philippines: International Rice Research Institute. PDF e-book."
            ],
            "source_texts": [
              "lesion is oval"
            ],
            "source_artifacts": [
              "research_artifacts/runtime_v1/evidence_aware_rules_v1.json"
            ]
          }
        },
        {
          "canonical_value": "oblong",
          "display_name": "Oblong",
          "original_values": [
            "oblong"
          ],
          "aliases": [
            {
              "value": "oblong",
              "source": "explicit_normalization_alias",
              "source_reference": "neuro_symbolic/reasoning_engine.py:SYNONYM_MAP:oblong -> oblong"
            }
          ],
          "provenance": {
            "source_rule_ids": [
              "EA_RULE_CDDC7A936F"
            ],
            "evidence_ids": [],
            "record_ids": [
              "MKI_0602",
              "LSC_IMPL_175",
              "LSC_RULE_003"
            ],
            "source_ids": [
              "IRRI2018_FFD"
            ],
            "citations": [
              "Mew, T. W., Hibino, H., Savary, S., Vera Cruz, C. M., Opulencia, R., and Hettel, G. P., eds. 2018. Rice Diseases: Biology and Selected Management Practices. Los Baños, Philippines: International Rice Research Institute. PDF e-book."
            ],
            "source_texts": [
              "lesion is more or less oblong"
            ],
            "source_artifacts": [
              "research_artifacts/runtime_v1/evidence_aware_rules_v1.json"
            ]
          }
        },
        {
          "canonical_value": "elongated",
          "display_name": "Elongated",
          "original_values": [
            "elongated"
          ],
          "aliases": [],
          "provenance": {
            "source_rule_ids": [
              "EA_RULE_FD2BA45FBC"
            ],
            "evidence_ids": [],
            "record_ids": [
              "MKI_0426",
              "NBLS_IMPL_185",
              "NBLS_RULE_006"
            ],
            "source_ids": [
              "IRRI2018_FFD"
            ],
            "citations": [
              "Mew, T. W., Hibino, H., Savary, S., Vera Cruz, C. M., Opulencia, R., and Hettel, G. P., eds. 2018. Rice Diseases: Biology and Selected Management Practices. Los Baños, Philippines: International Rice Research Institute. PDF e-book."
            ],
            "source_texts": [
              "lesions are elongated"
            ],
            "source_artifacts": [
              "research_artifacts/runtime_v1/evidence_aware_rules_v1.json"
            ]
          }
        },
        {
          "canonical_value": "narrow",
          "display_name": "Narrow",
          "original_values": [
            "narrow"
          ],
          "aliases": [
            {
              "value": "narrow",
              "source": "explicit_normalization_alias",
              "source_reference": "neuro_symbolic/reasoning_engine.py:SYNONYM_MAP:narrow -> narrow"
            }
          ],
          "provenance": {
            "source_rule_ids": [
              "EA_RULE_83353103A2"
            ],
            "evidence_ids": [],
            "record_ids": [
              "MKI_0423",
              "NBLS_IMPL_182",
              "NBLS_RULE_003"
            ],
            "source_ids": [
              "IRRI2018_FFD"
            ],
            "citations": [
              "Mew, T. W., Hibino, H., Savary, S., Vera Cruz, C. M., Opulencia, R., and Hettel, G. P., eds. 2018. Rice Diseases: Biology and Selected Management Practices. Los Baños, Philippines: International Rice Research Institute. PDF e-book."
            ],
            "source_texts": [
              "narrow brown lesions are observed"
            ],
            "source_artifacts": [
              "research_artifacts/runtime_v1/evidence_aware_rules_v1.json"
            ]
          }
        }
      ],
      "enum_validated": true,
      "boolean_support": false,
      "boolean_allowed_values": null,
      "boolean_values_origin": null,
      "numeric_constraints": null,
      "field_source": "research_artifacts/runtime_v1/neuro_symbolic_input_schema_v1.json:visual_features.lesion_shape",
      "limitations": []
    },
    "lesion_color": {
      "type": "string",
      "input_types": [
        "string"
      ],
      "categorical_values_available": true,
      "allowed_values": [
        {
          "canonical_value": "brown",
          "display_name": "Brown",
          "original_values": [
            "brown"
          ],
          "aliases": [],
          "provenance": {
            "source_rule_ids": [
              "EA_RULE_83353103A2"
            ],
            "evidence_ids": [],
            "record_ids": [
              "MKI_0423",
              "NBLS_IMPL_182",
              "NBLS_RULE_003"
            ],
            "source_ids": [
              "IRRI2018_FFD"
            ],
            "citations": [